"Status","Start Time","Stop Time","Duration in ms","Parent Suite","Suite","Sub Suite","Test Class","Test Method","Name","Description"
"passed","Mon Dec 09 12:30:50 UTC 2024","Mon Dec 09 12:30:50 UTC 2024","52","API - Login","","","","","Validar a realização do login com falha (Usuário Inexistente)",""
"passed","Mon Dec 09 12:30:57 UTC 2024","Mon Dec 09 12:30:57 UTC 2024","79","Cadastro","","","","","Validar a realização do cadastro com sucesso",""
"passed","Mon Dec 09 12:30:50 UTC 2024","Mon Dec 09 12:30:50 UTC 2024","59","API - Login","","","","","Deve falhar ao tentar login com senha incorreta",""
"passed","Mon Dec 09 12:30:53 UTC 2024","Mon Dec 09 12:30:53 UTC 2024","124","Cadastro de Produto (API)","","","","","Validar o cadastro do produto com sucesso (via API)",""
"passed","Mon Dec 09 12:30:57 UTC 2024","Mon Dec 09 12:30:57 UTC 2024","78","Cadastro","","","","","Validar a mensagem de e-mail já sendo utilizado",""
"passed","Mon Dec 09 12:30:54 UTC 2024","Mon Dec 09 12:30:54 UTC 2024","115","Cadastro de Produto (API)","","","","","Validar a validação dos campos obrigatórios",""
"passed","Mon Dec 09 12:30:50 UTC 2024","Mon Dec 09 12:30:50 UTC 2024","154","API - Login","","","","","Deve realizar login com sucesso",""
"passed","Mon Dec 09 12:30:57 UTC 2024","Mon Dec 09 12:30:57 UTC 2024","57","Cadastro","","","","","Validar a validação dos campos obrigatórios",""
